<?xml version="1.0" encoding="UTF-8"?>
<xs:schema xmlns:xs="http://www.w3.org/2001/XMLSchema">
    <xs:element name="application">
        <xs:complexType>
            <xs:sequence>
                <xs:element name="wizard">
                    <xs:complexType>
                        <xs:sequence>
                            <xs:element name="title" type="xs:string" minOccurs="0"/>
                            <xs:element name="mode" minOccurs="0" maxOccurs="unbounded">
                                <xs:complexType>
                                    <xs:sequence>
                                        <xs:element name="id" type="xs:string"/>
                                        <xs:element name="name" type="xs:string"/>
                                        <xs:element name="choice" minOccurs="0">
                                            <xs:complexType>
                                                <xs:sequence>
                                                    <xs:element name="option" maxOccurs="unbounded">
                                                        <xs:complexType>
                                                            <xs:simpleContent>
                                                                <xs:extension base="xs:string">
                                                                    <xs:attribute name="value" type="xs:string"/>
                                                                    <xs:attribute name="label" type="xs:string"/>
                                                                </xs:extension>
                                                            </xs:simpleContent>
                                                        </xs:complexType>
                                                    </xs:element>
                                                </xs:sequence>
                                            </xs:complexType>
                                        </xs:element>
                                        <xs:element name="control-panel" minOccurs="0">
                                            <xs:complexType>
                                                <xs:sequence>
                                                    <xs:element name="setting" minOccurs="0" maxOccurs="unbounded">
                                                        <xs:complexType>
                                                            <xs:simpleContent>
                                                                <xs:extension base="xs:string">
                                                                    <xs:attribute name="name" type="xs:string"/>
                                                                    <xs:attribute name="value" type="xs:string"/>
                                                                </xs:extension>
                                                            </xs:simpleContent>
                                                        </xs:complexType>
                                                    </xs:element>
                                                </xs:sequence>
                                            </xs:complexType>
                                        </xs:element>
                                        <xs:element name="warning" minOccurs="0" type="xs:string"/>
                                        <xs:element name="question" minOccurs="0" type="xs:string"/>
                                    </xs:sequence>
                                    <xs:attribute name="id" type="xs:string"/>
                                    <xs:attribute name="binary" type="xs:boolean" default="false"/>
                                </xs:complexType>
                            </xs:element>
                        </xs:sequence>
                    </xs:complexType>
                </xs:element>
            </xs:sequence>
            <xs:attribute name="lang" type="xs:string"/>
        </xs:complexType>
    </xs:element>
</xs:schema>
